{
  "schema_version": "1.0.0",
  "thread_anchor": "MEMORY_ARCHITECTURE__CASEBUILDER_4000__APEX_MEMORY_NEXUS__PR_51",
  "generated_at": "2026-07-23T03:30:38Z",
  "connector_id": "supermemory",
  "namespace": "sm_project_memory_master",
  "control_ref": "github://GlacierEQ/AEON-777/BRAIN/CONNECTORS/MEMORY_NAMESPACE_CONTROL.json",
  "fixture": {
    "record_class": "control_canary",
    "source_version": "1.0.0",
    "payload_sha256": "f9d18bffbe21cf7a658b0881c7dc92039636b4c0d057b1cac4b673f76327dfa0",
    "idempotency_key": "e3f2ff4216546b1aed274c655fe9d3b367044a0101d2b834fcca761241210677",
    "sensitivity": "internal",
    "contains_case_content": false
  },
  "write_attempts": [
    { "attempt": 1, "status": "success", "memory_id": "t5gh14KtFr6EoSQymcnB3J", "namespace": "sm_project_memory_master" },
    { "attempt": 2, "status": "success", "memory_id": "t5gh14KtFr6EoSQymcnB3J", "namespace": "sm_project_memory_master" }
  ],
  "deduplication": {
    "same_memory_id": true,
    "duplicate_canonical_records": 0,
    "backend_evidence_state": "observed_once_not_contractual"
  },
  "read_after_write": {
    "status": "success",
    "content_block_count": 1,
    "idempotency_key_found": true,
    "thread_anchor_found": true,
    "raw_response_persisted": false
  },
  "result": "pass_observed_idempotent_replay",
  "boundaries": {
    "namespace_approved": false,
    "owner_assigned": false,
    "production_activation_authorized": false,
    "backend_contract_proven": false
  }
}
